{
  "$id": "lena_video_character_authority_v1.schema.json",
  "$schema": "https://json-schema.org/draft/2020-12/schema",
  "type": "object",
  "additionalProperties": false,
  "required": ["schema_version", "artifact_type", "artifact_id", "property_id", "video_id", "governed_date", "created_at", "generator_version", "upstream_artifacts", "identity_name", "adult_status", "character_element_uuid", "character_element_token", "direct_character_element_binding_required", "face_authority", "body_authority", "hair_authority", "skin_authority", "posture_camera_relationship", "wardrobe_doctrine", "reference_image_clothing_exclusion", "prohibited_identity_drift", "prohibited_provider_styling", "provider_prompt_cue"],
  "properties": {
    "schema_version": {"const": "lena_video_artifact_v1"}, "artifact_type": {"const": "lena_video_character_authority_v1"}, "artifact_id": {"$ref": "common_defs_v1.schema.json#/$defs/artifact_id"}, "property_id": {"const": "lena"}, "video_id": {"$ref": "common_defs_v1.schema.json#/$defs/video_id"}, "governed_date": {"$ref": "common_defs_v1.schema.json#/$defs/governed_date"}, "created_at": {"$ref": "common_defs_v1.schema.json#/$defs/created_at"}, "generator_version": {"$ref": "common_defs_v1.schema.json#/$defs/slug"}, "upstream_artifacts": {"$ref": "common_defs_v1.schema.json#/$defs/upstream_artifacts"},
    "identity_name": {"const": "Lena"}, "adult_status": {"const": "verified_adult"}, "character_element_uuid": {"const": "6a842337-ef20-4cb9-a0ff-04fa5eb8f8d3"}, "character_element_token": {"const": "@[Lena](6a842337-ef20-4cb9-a0ff-04fa5eb8f8d3)"}, "direct_character_element_binding_required": {"const": true}, "face_authority": {"$ref": "common_defs_v1.schema.json#/$defs/nonempty_string"}, "body_authority": {"$ref": "common_defs_v1.schema.json#/$defs/nonempty_string"}, "hair_authority": {"$ref": "common_defs_v1.schema.json#/$defs/nonempty_string"}, "skin_authority": {"$ref": "common_defs_v1.schema.json#/$defs/nonempty_string"}, "posture_camera_relationship": {"$ref": "common_defs_v1.schema.json#/$defs/nonempty_string"}, "wardrobe_doctrine": {"$ref": "common_defs_v1.schema.json#/$defs/string_list"}, "reference_image_clothing_exclusion": {"const": true}, "prohibited_identity_drift": {"$ref": "common_defs_v1.schema.json#/$defs/string_list"}, "prohibited_provider_styling": {"$ref": "common_defs_v1.schema.json#/$defs/string_list"}, "provider_prompt_cue": {"$ref": "common_defs_v1.schema.json#/$defs/provider_prompt_cue"}
  }
}
